{
  "atoms": [
    {
      "atom": "C",
      "base_branch": "prel/58-execution-plan",
      "branch": "prel/59-scene-spec-contract",
      "budget": {"maximum_files": 3, "maximum_hours": 4},
      "completion_dependencies": ["SCENE_SPEC_CONTRACT_RECEIPT_PASS"],
      "consumes_paths": ["evals/execution-plan/structured-product-compiler/run-contract.json", "evals/technical-systems/modern-web-architecture/technical-systems-packet.json"],
      "id": "PREL-C02",
      "lane": "CLOUD",
      "negative_controls": ["unknown scene fields rejected", "canonical key ordering cannot drift", "digest changes after semantic mutation", "no rendering/provider dependency enters the core"],
      "oracle": "Three canonical scene objects serialize byte-stably, round-trip without state repair, and reproduce the same SHA-256 digest.",
      "owns_paths": ["schemas/scene-spec.schema.json", "src/ai_product_notes/scene_spec.py", "tests/test_scene_spec_contract.py"],
      "parents": [],
      "purpose": "Materialize owned SceneSpec schema, canonical serialization and digest contract.",
      "rollback": "Delete the candidate SceneSpec paths and return to the Stage 7 planning subject.",
      "stack_class": "root",
      "start_dependencies": ["STAGE7_EXACT_PLAN_READABLE"]
    },
    {
      "atom": "K",
      "base_branch": "prel/59-scene-spec-contract",
      "branch": "prel/60-constraint-validator",
      "budget": {"maximum_files": 2, "maximum_hours": 5},
      "completion_dependencies": ["PREL-C02_RECEIPT_PASS", "CONSTRAINT_VALIDATOR_RECEIPT_PASS"],
      "consumes_paths": ["src/ai_product_notes/scene_spec.py", "schemas/scene-spec.schema.json"],
      "id": "PREL-K03",
      "lane": "CLOUD",
      "negative_controls": ["validator cannot mutate SceneSpec", "unknown rules fail closed", "receipt for old scene digest becomes stale", "no probabilistic backend required"],
      "oracle": "Valid scenes yield digest-bound PASS receipts; planted missing assets, invalid bounds and conflicting constraints fail with stable rule identifiers.",
      "owns_paths": ["src/ai_product_notes/constraint_validator.py", "tests/test_constraint_validator.py"],
      "parents": ["PREL-C02"],
      "purpose": "Implement deterministic constraint validation over the admitted SceneSpec interface.",
      "rollback": "Remove validator paths while retaining the admitted SceneSpec contract.",
      "stack_class": "child",
      "start_dependencies": ["PREL-C02_INTERFACE_BYTES_READABLE"]
    },
    {
      "atom": "E",
      "base_branch": "prel/60-constraint-validator",
      "branch": "prel/61-scene-deterministic-evals",
      "budget": {"maximum_files": 3, "maximum_hours": 4},
      "completion_dependencies": ["PREL-C02_RECEIPT_PASS", "PREL-K03_RECEIPT_PASS", "DETERMINISTIC_EVAL_RECEIPT_PASS"],
      "consumes_paths": ["src/ai_product_notes/scene_spec.py", "src/ai_product_notes/constraint_validator.py"],
      "id": "PREL-E02",
      "lane": "CLOUD",
      "negative_controls": ["green unit tests cannot satisfy runtime lane", "one passing edit cannot satisfy three-case denominator", "mutation must invalidate old receipt", "failure cases remain in denominator"],
      "oracle": "All three canonical edits pass round-trip and all planted invalid/mutation cases fail with the expected stable receipt state.",
      "owns_paths": ["tests/test_structured_scene_e2e.py", "evals/structured-scene/deterministic/**"],
      "parents": ["PREL-K03"],
      "purpose": "Run positive, negative and mutation controls for the deterministic scene compiler wedge.",
      "rollback": "Remove deterministic eval artifacts without changing C/K implementation bytes.",
      "stack_class": "child",
      "start_dependencies": ["PREL-K03_INTERFACE_BYTES_READABLE"]
    },
    {
      "atom": "X",
      "base_branch": "prel/61-scene-deterministic-evals",
      "branch": "prel/62-structured-scene-runtime-canary",
      "budget": {"maximum_files": 3, "maximum_hours": 2},
      "completion_dependencies": ["PREL-E02_RECEIPT_PASS", "LOCAL_RUNTIME_RECEIPT_PASS"],
      "consumes_paths": ["src/ai_product_notes/scene_spec.py", "src/ai_product_notes/constraint_validator.py", "evals/structured-scene/deterministic/**"],
      "id": "PREL-X02",
      "lane": "LOCAL",
      "negative_controls": ["hosted CI cannot impersonate local runtime", "exit zero without receipt is insufficient", "dirty workspace blocks execution", "rendering/provider remains out of scope"],
      "oracle": "A clean local checkout executes one complete structured-state→validation workflow and emits an exact input/output/receipt digest with cleanup.",
      "owns_paths": ["scripts/run_structured_scene_canary.py", "evals/structured-scene/runtime/**"],
      "parents": ["PREL-E02"],
      "purpose": "Exercise one bounded owned local workflow using only the deterministic SceneSpec and validator.",
      "rollback": "Delete runtime canary artifacts and keep deterministic C/K/E receipts unchanged.",
      "stack_class": "child",
      "start_dependencies": ["PREL-E02_RECEIPT_READABLE", "LOCAL_CLEAN_CHECKOUT_AVAILABLE"]
    },
    {
      "atom": "D",
      "base_branch": "prel/62-structured-scene-runtime-canary",
      "branch": "prel/63-structured-product-convergence",
      "budget": {"maximum_files": 2, "maximum_hours": 2},
      "completion_dependencies": ["PREL-C02_RECEIPT_PASS", "PREL-K03_RECEIPT_PASS", "PREL-E02_RECEIPT_PASS", "LOCAL_RUNTIME_RECEIPT_PASS", "CONVERGENCE_READBACK_PASS"],
      "consumes_paths": ["schemas/scene-spec.schema.json", "src/ai_product_notes/scene_spec.py", "src/ai_product_notes/constraint_validator.py", "evals/structured-scene/deterministic/**", "evals/structured-scene/runtime/**"],
      "id": "PREL-D02",
      "lane": "CLOUD",
      "negative_controls": ["shared index has exactly one writer", "missing receipt stays missing", "user/paid/rights remain separate", "no merge/release claim"],
      "oracle": "Every documented state, branch and receipt resolves to an exact subject; no remaining lane is promoted beyond its evidence.",
      "owns_paths": ["docs/architecture/STRUCTURED_PRODUCT_COMPILER.md", "docs/git/STACKED_PRS.md"],
      "parents": ["PREL-C02", "PREL-K03", "PREL-E02", "PREL-X02"],
      "purpose": "Converge README/AGENTS/State Machine/DAG/Stack indexes after admitted implementation receipts exist.",
      "rollback": "Revert only the convergence documentation commit; preserve implementation and receipts.",
      "stack_class": "convergence",
      "start_dependencies": ["ALL_ADMITTED_LEAF_RECEIPTS_READABLE"]
    }
  ],
  "authority_ceiling": "PLANNING_ONLY",
  "decision": "VALIDATE",
  "existing_gates": [
    {"issue": 33, "relation": "EXISTING_GATE_DIFFERENT_PRODUCT_TARGET", "required_action": "DO_NOT_DUPLICATE_OR_SUBSTITUTE", "state": "OPEN", "target": "Agent Contract Evolution Replay CI", "title": "Validate recurring pain with 3 qualified teams"},
    {"issue": 34, "relation": "EXISTING_GATE_DIFFERENT_PRODUCT_TARGET", "required_action": "DO_NOT_DUPLICATE_OR_SUBSTITUTE", "state": "OPEN", "target": "Agent Contract Evolution Replay CI", "title": "Obtain paid pilot or binding adoption evidence"},
    {"issue": 35, "relation": "GLOBAL_HOSTED_OWNER_POLICY_REFERENCE", "required_action": "KEEP_SEPARATE", "state": "OPEN", "target": "hosted Agent Contract Evolution Replay CI", "title": "Select and prove a durable hosted owner"},
    {"issue": 38, "relation": "GLOBAL_RUNTIME_POLICY_REFERENCE", "required_action": "KEEP_SEPARATE", "state": "OPEN", "target": "existing market experiment", "title": "Exercise real market experiment and executable delivery path"},
    {"issue": 43, "relation": "META_INDEX_REFERENCE", "required_action": "RECONCILE_NOT_DUPLICATE", "state": "OPEN", "target": "repository-wide existing program", "title": "Close all remaining AI Product Notes session work"}
  ],
  "human_owned_operations": ["merge", "release", "rights admission", "customer truth", "commercial truth", "production promotion", "semantic conflict resolution"],
  "issue_plan": [
    {"action": "CREATE_PROPOSAL", "atom_id": "PREL-C02", "existing_issue": null, "plan_id": "IP-001", "title": "[PREL C02] Materialize deterministic SceneSpec contract and canonical digest", "write_authority": "PROPOSAL_ONLY"},
    {"action": "CHILD_OF_IP-001", "atom_id": "PREL-K03", "existing_issue": null, "plan_id": "IP-002", "title": "[PREL K03] Implement deterministic constraint validator", "write_authority": "PROPOSAL_ONLY"},
    {"action": "CHILD_OF_IP-002", "atom_id": "PREL-E02", "existing_issue": null, "plan_id": "IP-003", "title": "[PREL E02] Execute deterministic SceneSpec/constraint mutation controls", "write_authority": "PROPOSAL_ONLY"},
    {"action": "CHILD_OF_IP-003", "atom_id": "PREL-X02", "existing_issue": null, "plan_id": "IP-004", "title": "[PREL X02] Exercise bounded local structured-scene runtime canary", "write_authority": "PROPOSAL_ONLY"},
    {"action": "CONVERGENCE_AFTER_LEAVES", "atom_id": "PREL-D02", "existing_issue": null, "plan_id": "IP-005", "title": "[PREL D02] Converge structured product compiler State Machine and Stack indexes", "write_authority": "PROPOSAL_ONLY"}
  ],
  "nonclaims": ["Planning output does not prove any Worker executed.", "No rendering library/model/provider is selected.", "No user, paid, rights, merge, release or production state is promoted."],
  "run_id": "prel-stage7-structured-product-compiler-2026-08-20",
  "schema_version": "execution-planner-input@1",
  "subject_digest": "b14da457a71456bfa27e814b6e92fa9468b86095480daa7b8abf61705904c349"
}
